{
  "schemaVersion": "eutxo-zk-preview-release-contract/v1",
  "releaseDecision": "EXPERIMENTAL_TESTNET_ONLY",
  "recipe": "eutxo-zeroj-preview:1",
  "runtimeTypes": ["jvm"],
  "supportedNetworks": ["devnet", "preview", "preprod"],
  "mainnet": "REJECTED",
  "fundsPolicy": "disposable-test-funds-only",
  "trustedProverRequired": true,
  "identities": {
    "yanoVersion": "0.1.0-pre11",
    "zerojVersion": "0.1.0-pre10",
    "julcVersion": "0.1.0-pre14",
    "ledgerProfile": "yano-eutxo-v1",
    "ledgerProfileDigest": "2499d01ee7cb0d09d0d498040c6351accd9da83df31666cd4463d0b1722d1212",
    "transactionFormat": "yano-eutxo-l2-envelope-v1",
    "validityProvider": "zeroj-poseidon-v1",
    "validityProfile": "yano-eutxo-zk-z3",
    "validityProfileDigest": "cfe1767761cbe05c7e2b82f951222fbb9df34afa5eb1f39fb8a5c1cc2af87d45",
    "authorizationProfile": "zeroj-jubjub-dev-v1",
    "authorizationProfileDigest": "d4d23eb620057fa280616f8e117aa7b38f7895fc3be2626566a3fd06444cb035",
    "authorizationPointChecks": "host-only-development",
    "batchProfile": "cardano-payment-b16",
    "batchProfileDigest": "286483b1169ebb1e91fc0848195ac8a2e7ec12f865beb40145d7a90c35a9c574",
    "maximumTransactions": "16",
    "circuitId": "eutxo-jubjub-batch-dev-b16-v1",
    "proofSystem": "groth16",
    "curve": "bls12-381",
    "verificationKeyIdentity": "project-pinned-at-ceremony-bootstrap",
    "validatorIdentity": "project-pinned-at-contract-bootstrap"
  },
  "sourceDigests": {
    "capabilityCatalogSha256": "3eb686a3f4c35719e58cbb65abbcfeb1f222f6af72d242a195881d335e1044ff",
    "networkAcceptanceSha256": "429c4b135865c54b786000ea942201aa4fb68b2053f56def90e862710bd014f5"
  },
  "compatibility": {
    "cardanoClientLib": "SUPPORTED_WITH_YANO_ENVELOPE",
    "cardanoCli": "SUPPORTED_L1",
    "backendWallets": "SUPPORTED_L1",
    "cip30SignTx": "SUPPORTED_L1",
    "cip30SignDataKeyDerivation": "REQUIRES_COMPATIBILITY_TESTING",
    "cardanoTransactionBodyBuilders": "SUPPORTED_L2_BODY_ONLY"
  },
  "openSecurityGates": [
    "jubjub-adversarial-circuit-hardening",
    "independent-circuit-and-validator-audit",
    "production-multi-party-ceremony",
    "live-devnet-preview-preprod-round-trip",
    "rollback-and-disaster-recovery-evidence",
    "independent-data-reconstruction",
    "accountable-production-funds-approval"
  ]
}
